{
  "schemaVersion": "1.0.0",
  "envelopeVersion": "PBKEY1",
  "keyKind": "CLIENT_ROOT_KEY",
  "keyId": "aaaaaaaa-aaaa-4aaa-8aaa-aaaaaaaaaaaa",
  "ownerId": "11111111-1111-4111-8111-111111111111",
  "parentKeyId": null,
  "kdf": {
    "algorithm": "scrypt",
    "salt": "AAECAwQFBgcICQoLDA0ODw",
    "N": 131072,
    "r": 8,
    "p": 1,
    "dkLen": 32,
    "maxmem": 268435456
  },
  "cipher": {
    "algorithm": "AES-256-GCM",
    "iv": "EBESExQVFhcYGRob",
    "ciphertext": "j8ydUMeZ1wygGZ8nT85vlg1nGJ-MyJ7JFaXssWMfudY",
    "authTag": "B3zc9BsSSNyOZGrneY9vFw",
    "aad": "PBKEY1\u000022222222-2222-4222-8222-222222222222\u000011111111-1111-4111-8111-111111111111\u0000\u0000CLIENT_ROOT_KEY"
  },
  "createdAt": "2026-08-25T08:00:00Z"
}
